姓名,职称,电话,pic,邮箱,url,经历
陈泉源,教授,021-67792540,http://env.dhu.edu.cn/_upload/article/a2/bb/27d7415345efa2cb132a8c35e799/975b9ee7-3e8f-4b29-911b-861b524c1f7e.jpg,qychen@dhu.edu.cn ,http://env.dhu.edu.cn/f9/4a/c8125a129354/page.htm,"陈泉源陈泉源，1962年8月出生。环境工程学科教授。他参加或主持多项资源综合利用工艺及产品开发研究，近五年,  研制了高气泡表面积通量浮选柱；研究了污染物水泥基固化及稳定化，利用XRD、 NMR、SEM/EDS、TEM、DTA/TG等分析测试手段和热力学模拟  (地球化学模拟软件PHREEQC)，探讨污染物固化及稳定化过程中，相发展过程及相平衡和污染物稳定化机理，发现胶凝材料碳酸化及其它处理，促进C-S-H 凝胶聚合，提高对重金属离子等的化学键合能力；开发了聚合铝硅酸盐吸附材料。 研究方向： 废水处理、危险废物稳定及填埋、工业废渣资源化、污染土壤修复、烟气净化、污染物扩散模拟、 环境功能材料 荣誉和获奖情况： 1、铌冶炼新工艺产品开发获国家科技进步一等奖，1989年  2、大型多金属矿弱磁-强磁-浮选新工艺获冶金部科技进步特等奖，1992年  3、国务院政府津贴，1994年  4、国家有突出贡献中青年专家称号，1997年  近几年发表论著： 1、浮选柱研究与发展动向，矿冶工程，2000年  2、矿物加工方法应用新领域—污染土壤治理，矿冶工程，2001年  3、气泡与颗粒作用研究新进展，国外金属矿选矿，2001年  4、An overview of mineral processing in China , Rare Metals, 2001年  国际交流与合作： 1、1999.5-2000.5，到柏林工业大学作高级访问学者 2、2000.10-2003.10，英国THE　UNIVERSITY　OF　GREENWICH学习，获博士学位 其他信息：  致力于废物处理、污染物扩散模拟、环境功能材料等领域的教学与研究，讲授大气污染控制工程、固体废弃物处理(双语)、环境工程前沿领域等课程  联系电话：021-67792540 　 EMAIL：qychen@dhu.edu.cn "
李登新,教授,13636641041,http://env.dhu.edu.cn/_upload/article/11/ea/6636df4747da8dd6dc861c131515/fdd3e6f8-a727-4868-870d-80bd3d700045.jpg,13636641041@163.com,http://env.dhu.edu.cn/f9/49/c8125a129353/page.htm,"李登新    李登新，环境工程学科教授、博士生导师。主要研究成果有黄金冶炼氰化尾渣提金及综合利用研究、高硫高砷硫酸化焙烧渣资源综合利用研究、流化床飞灰快速水化团聚研究和银系纳米环境净化材料技术研发,发表SCI、EI、ISTP 和核心期刊以上论文50余篇，获发明专利8项，实用新型1项。清华大学优秀博士后，曾获教育部科技进步一等奖1项、山东省科技进步三等奖1项。 研究方向： 清洁生产和废物资源化；水处理技术；绿色材料 近几年承担的科研项目： 1、国家863项目《可循环氧化剂氧化高硫高砷难选金精矿或氰化尾渣提金和综合利用》（主持） 2、上海市科委重点项目《电子废弃物提金技术与网络化》（子课题主持） 3、国家博士后基金《循环流化床飞灰快速水化与团聚机理》（主持，已完成） 3、国家科委973项目《循环流化床飞灰快速水化造粒返送流化床研究》（参加，已完成） 4、国家科委中小企业基金项目《黄金冶炼尾渣去氰提金及综合利用》（参加） 5、日本阳光计划项目《煤快速加氢气化制天然气》（主持，已完成） 6、原煤炭部科学基金项目《煤的电化学脱硫》（主持，已完成） 7、中金黄金总公司项目《酸浸渣的综合利用》（主持） 8、蓬莱黄金集团总公司蓬莱黄金冶炼厂项目《黄金冶炼氰化尾渣提金与综合利用》（主持、已完成） 9、上海市劳动局项目《室内治理职业标准》（主持） 10、湖北省废物地质处置与环境保护重点实验室项目《用催化氧化法研究电子废弃物提金及综合利用》（主持，已完成） 近几年发表论文情况： 1、Li Dengxin，Gao Jinsheng，Yue Guangxi，Kinetics of Catalytic Oxidation  of　Pyrite by Electrolysis, Fuel Processing and Technology,2003，82（1）,p75-85  （同时被SCI,EI收录，（SCI689ZT, EI03247501747） 2、李登新，吕俊复，刘青等，高碳团聚飞灰的燃烧特性，中国电机工程学报2004.024(011).-213-216，(EI05028785746 ,*CSCD) 3、李登新，高晋生，吕俊复，煤中有机硫的电化学脱硫机理，燃烧科学与技术，2002，8（5），p421-424（CSCD, EI03047336966 ）   4、李登新，吕俊复，刘青等，飞灰快速水化团聚颗粒在流化床中的冷态磨耗研究，煤炭学报.2003.028(006).-622-62，（EI04027814606  ,*CSCD） 5、李登新，Makino,吕俊复，岳光溪，弱粘煤与不粘煤的快速热解与团聚研究，燃烧科学与技术，2003，9(5)，426-429（EI04108053100  ，CSCD） 6、李登新，徐猛，吕俊复，循环流化床灰渣研究进展，热能动力工程，2003，No.1,（EI03087366508 ，CSCD） 7、李登新，高晋生，岳光溪，电化学脱硫的热力学分析，煤炭学报，2002，27（3）, p320-325 （*CSCD） 8、李登新，高晋生，孟繁玲，高硫煤的电化学净化对煤质的影响，华东理工大学学报，2001，27（2），p421（*CSCD） 9、李登新，吕俊复，岳光溪,循环流化床飞灰快速水化及其反应活性研究，过程工程学报，2002、11，p372,第二卷增刊（*CSCD） 10、Li Dengxin，Meng Fanling，Utilization of Derived Pyrite by Electrolysis,  Journal Of Coal Science & Engineering (China), 2001, 7(2), p91-94，(*CSCD) 11、Li Dengxin,Xu Meng,Yue Guangxi, Development of Utilization of CFB Fly  Ash, Proceedings of the International Conference on Power Engineering-03  (ICOPE-03)，KOBE，2003，11，（国际会议） 12、Li Dengxin,Xu Meng,Yue Guangxi, Flash Hydration and Agglomeration of Fly  Ash,17th CFBC,05/2003，（国际会议） 13、徐　猛，李登新，王启民，飞灰水活化团聚脱硫技术,煤炭转化，2003，26（1），P23-25 (CSCD )，  14、徐猛，李登新，王启民，吕俊复，岳光溪，循环流化床锅炉飞灰的水活化与脱硫，燃烧科学与技术，2004，010(001)，-62-65（  EIP04258221759 ， CSCD）  15、郭庆杰，王启民，徐　猛，李登新，高温鼓泡流化床的压力波动，燃烧科学与技术，2002，8（6），p487-492（EI03177450328 ，  CSCD），  16、吕俊复，杨海瑞，张建胜，刘青，李登新等，流化床燃烧煤的成灰磨耗特性,燃烧科学与技术，2003,9(1)（EI03237499701，CSCD） 17、Wei Jinxiu，Wang Yonghui, Li Dengxin，The Hazard and Recycled Technique of  the Electronic Scrap, International Conference on Electronic Waste and  Extended Producer Responsibility in China, 159-167, 27/4/2004, （国际会议） 18、GUO Qing-jie，WANG Qimini，XU Meng，Li Dengxin，DUDA Toshiyuki，SATO Junichi,  Pressure Fluctuations in a BubbHng Fluidized Bed at High Temperature Journal  of Combustion Science and Technology 2002，v 8 n 6 December ，（ EI03177450328  ， CSCD） 19、魏金秀，汪永辉，李登新，国内外电子废弃物现状及其资源化技术，东华大学学报，2005，31（3），-33-38（CSCD） 20、李登新，赵庆，钟非文，魏金秀，电子废弃物的湿法提金研究进展，第二届全国环境化学学术报告会，（国内会议），2004.10，上海 近几年获得专利情况： 1、一种流化床飞灰快速水化团聚和返送流化床工艺 国家发明专利，ZL01144585.8，排名第一 2、一种带有飞灰快速水化团聚和返送流化床复燃的流化床 国家发明专利，ZL01278943.7，排名第一 3、一种以氰化提金废渣制备铁红的工艺方法 国家发明专利，ZL01134737.6，排名第一 4、一种以氰化提金废渣再提金工艺方法（授权，排名第一）ZL01134738.7，排名第一 5、一种气化型煤粘结剂及其制备方法 国家发明专利，ZL01120439.7，排名第一 6、一种正燃式蜂窝状烟煤无烟燃烧型煤 国家发明专利，ZL01130895.8，排名第一 7、一种提高流化床飞灰脱硫和燃尽效率的添加剂及使用方法 国家发明专利，ZL02130911.6，排名第一 8、一种废弃光盘的综合利用方法 国家发明专利，ZL200410084790.2，排名第一 国际交流与合作情况： 曾去日本工业技术研究院资源环境研究所做研究员  其他信息： 讲授研究生课程：环境材料、博士生前沿课－废弃物资源化最新研究进展 联系电话：021-67792541 EMAIL：13636641041@163.com"
刘建允,教授,67792381,http://env.dhu.edu.cn/_upload/article/79/6f/bb27a7084b95ae2d6b977a1a1d7b/9e10170b-adf0-461f-b800-68a7c5728fac.jpg,jianyun.liu@dhu.edu.cn,http://env.dhu.edu.cn/f9/4b/c8125a129355/page.htm,"    刘建允：女，博士，环境工程系，教授，博士生导师1995年及1998年在河南师范大学化学系分别获得理学学士和理学硕士学位。同年就读于中国科学院长春应用化学研究所电分析国家重点实验室，2002年获得理学博士学位。2002-2005年德国马普高分子研究所从事博士后研究工作。2006-2010年就职于美国通用电气（GE）公司全球研发中心(上海)。2010年至今获聘东华大学教授职位。2016-2017年获国家留学基金委资助于英国牛津大学访学一年。主要研究方向：水体有毒污染物电化学及光学检测超级电容器电去离子海水、苦咸水淡化新型纺丝纳米纤维材料及污染水体修复废水难降解污染物高级氧化技术改性碳纳米纤维及超级电容器社会兼职：国际电化学协会会员， 中国化学会会员研究成果：在环境污染物（光）电化学检测、超级电容器除盐、金属氧化物纳米材料、改性纺丝纳米纤维材料及环境应用等方面有多年的研究经验。承担国家自然科学基金3项及其他校企合作项目多项。在Anal. Chem. , Chem. Commun.,Desalination, Langmuir, Electrochem. Commun., Electrochim. Acta， Adv. Funct. Mater., Chem. Mater., J. Phys. Chem. B, Sensor & actuator B, Electroanalysis等国际著名学术刊物上发表论文90余篇, 其中SCI论文60余篇；获得15项发明专利授权。荣誉及获奖情况： 1、研究生优秀指导教师，2014，2015，2016，2018 2、东华大学“安全工作先进个人” 3、东华大学国际留学生“我心中的好老师”4、GE中国技术中心 Innovation Award，20085、吉林省科学技术进步一等奖，20046、德国马普奖学金，2002 -2004 近几年承担项目：离子筛赝电容器高选择性吸收锂及微观吸附机制分析， 2018.01-2021.12，国家自然科学基金，课题负责人静电纺功能化碳纳米纤维及不对称电容器淡化苦咸水研究, 2015.1-2018.12 ,国家自然科学基金，课题负责人基于电纺丝载体的纳米网络电极制备及其在重金属离子分析中的应用，2012,1-2014.12,国家自然科学(青年)基金，课题负责人。多孔碳纤维复合电极及其不对称超级电容器脱盐研究，2012.1-2014.12,中央高校基本科研业务费重点专项基金， 课题负责人。新型三维多孔电极制备及其在重金属离子传感器中的应用  2012.1-2013.12,电分析化学国家重点实验室基金，课题负责人纤维表面和剖面形貌及元素成分分析 2013-2015,横向课题, 课题负责人有机相中金属离子电分析方法研究， 2010-2012,横向课题,课题负责人吸附与电催化氧化联用处理难降解焦化废水，2009-2010，企业研发项目 课题负责人代表性论著：J. Dou, G. Zhu, B. Hu, J. Yang, Y. Ge, X. Li, J. Liu*, Wall thickness-tunable AgNPs-NCNTs for hydrogen peroxide sensing and oxygen reduction reaction, Electrochim. Acta, 2019, 306: 466-476W. Shi, P. Nie, X. Shang, J. Yang, Z. Xie, R. Xu, J. Liu*, Berlin green-based battery deionization-highly selective potassium recovery in seawater, Electrochim. Acta, 2019, 310: 104-112.Z. Xie, X. Shang, K. Xu, J. Yang, B. Hu, P. Nie, W. Jiang, J. Liu*, Facile Synthesis of In Situ Graphitic-N Doped Porous Carbon Derived from Ginkgo Leaf for Fast Capacitive Deionization, J. Electrochem. Soc., 2019,166: E240-E247.Z. Xie, X. Shang, J. Yan, T. Hussain, P. Nie, J. Liu*, Biomass-derived porous carbon anode for high-performance capacitive deionization, Electrochim. Acta,2018, 290: 407-415.X. Ke, G. Zhu, Y. Dai, Y. Shen, J. Yang, J. Liu*, Fabrication of Pt-ZnO composite nanotube modified electrodes for the detection of H2O2, J. Electroanal. chem., 2018, 817,176-183.T. Hussain, Y. Wang, Z. Xiong, J. Yang, Z. Xie, J. Liu*, Fabrication of electrospun trace NiO-doped hierarchical porous carbon nanofiber electrode for capacitive deionization, Journal of Colloid and Interface Science, 2018, 532, 343-351.Y. Shen,  G. Zhu, J. Yang, J. Liu*, Ultrafine copper decorated polypyrrole nanotube electrode for nitrite detection, Ionics,2018(6):1-11.G. Zhu, Y. Ge, Y. Dai, X. Shang, J. Yang, J. Liu*, Size-tunable polyaniline nanotube-modified electrode for simultaneous determination of  Pb(II) and Cd(II), Electrochim. Acta,2018, 268: 201-210.H. Zhang, Z. Xie, Y. Wang, X. Shang, P. Nie, J. Liu* Electrospun polyacrylonitrile/b-cyclodextrin based porous carbon nanofiber self-supporting electrode for capacitive deionization， RSC Adv.,  2017, 7, 55224.J. Liu, G. Zhu, X. Li, C. Batchelor-McAuley, S. Sokolov, R.G. Compton,Quantifying charge transfer to nanostructures: Polyaniline nanotubes, Appl. Mater. Today, 2017 ,7, 239-245.J. Liu, X. Li, C. Batchelor-AcAuley, G. Zhu, R.G. Compton. Nitrite-enhanced doping to/from polyaniline nanotube, Chemistry - A European Journal, 2017, 23, 17823-17828. Y Dai, G Zhu, X Shang, T Zhu, J Yang, J Liu , Electrospun zirconia-embedded carbon nanofibre for high-sensitive determination of methyl parathion, Electrochem. Commun.,2017,81, 14-17.Z. Xie, Jian Cheng, Junbin Yan, Wenshu Cai,  Pengfei Nie,  Henry T. H. Chan,  and Jianyun Liu ，Polydopamine Modiﬁed Activated Carbon for Capacitive Desalination Desalination，J. Electrochem. Soc., 2017, 164 (12) A2636-A2643 .Cai W, Yan J, Hussin T, et al. Nafion-AC-based asymmetric capacitive deionization[J]. Electrochim. Acta,2017, 225: 407-415Z. W. Cai, Z. Xiong, T. Hussain, J. Yang, Y. Wang, J. Liu*, Porous MnOx covered electrospun carbon nanofiber for capacitive deionization, J. Electrochem. Soc. ,2016, 163 (13) A2515-A2523 . J. Liu*, Z. Xiong, S. Wang, et al. Structure and electrochemistry comparison of electrospun porous carbon nanofibers for capacitive deionization[J]. Electrochim. Acta, 2016, 210: 171-180.J. Liu*, G. Zhu, M. Chen, X. Ma, J. Yang, Fabrication of electrospun ZnO nanofiber-modified electrode for the determination of trace Cd(II), 2016,Sensors and Actuators B 2016, 234, 84–91.H. Pan,   J. Yang,   S. Wang,   Z. Xiong,   W. Cai,  J. Liu*, Facile fabrication of porous carbon nanofibers by electrospun PAN/dimethylsulfone for capacitive deionization,J. Mater. Chem. A, 2015, 3,13827-13834.W. Cai, C. Feng, X. Ma, M. Chen, J. Liu, C2-Symmetric Benzene-based Low Molecular Weight Hydrogel Modified Electrode for Highly Sensitive Detection of Copper Ions,Electrochim. Acta, 2015, 169, 424-432.J. Liu*，M. Lu, J. Yang, J. Cheng, W. Cai, Capacitive desalination of ZnO/activated carbon asymmetric capacitor and mechanism analysis, Electrochim. Acta, 2015, 151, 312–318.J. Liu*, S.Wang, J. Yang, J. Liao, M. Lu, H. Pan, L. An, ZnCl2 activated electrospun carbon nanofiber for capacitive desalination, Desalination2014, , 344, 446–453M. Xin, X. Zhang, J. Yang, M. Chen, X. Ma, J. Liu*, Preparation and electrochemical sensing application of electrospun porous organosilica fibers, Electrochem. Commun.2014,48,123-126.  M. Xin, H. Lin, J. Yang, M. Chen, X. Ma, and J. Liu*, Preparation of Polyaniline/Au0 nanocomposites modified electrode and application for hydrazine detection, Electroanalysis 2014, 26, 2216-2223.H. Lin, J. Yang, J. Liu*, Y. Huang, J. Xiao, X. Zhang, Properties of Pd nanoparticles-embedded polyaniline multilayer film and its electrocatalytic activity for hydrazine oxidation, Electrochim. Acta 2013, 90, 382-392.Z. Wu, J. Liao, J. Xiao, J. Liu*， J.Yang, X. Zhou, M. Xin, Amino-Containing Ultrafine Organosilica-Nanoparticle-Modified Au Electrode for the Determination of Cu(II) Ions, Electroanalysis, 2013, 25 (11), 2557- 2566.J. Yang, L. Zha, D. Yu, J. Liu*, Coaxial electrospinning with acetic acid for preparing ferulic acid/zein composite fibers with improved drug release profiles, Colloid Surface B2013, 102, 737-743.J. Liu, L. Tiefenauer, S. Tian, P. E. Nielsen, W. Knoll, PNA-DNA hybridization study using labeled streptavidin by voltammetry and surface plasmon fluorescence spectroscopy  Anal. Chem.2006, 78, 470-476.J. Liu, S. Tian, L. Tiefenauer, P. E. Nielsen, W. Knoll, Simultaneously Amplified Electrochemical and Surface Plasmon Optical Detection of DNA Hybridization Based on Ferrocene-Streptavidin Conjugates  Anal. Chem. 2005, 77, 2756-2761.J. Liu, S. Tian, P. E. Nielsen, W. Knoll, In Situ Hybridization of PNA/DNA Studied Label-free by Electrochemical Impedance Spectroscopy Chem. Commun.2005, 23, 2969-2971.J. Liu, S. Tian, W. Knoll, Properties of Polyaniline/Carbon Nanotube Multilayer Films in Neutral Solution and Their Application for Stable Low-Potential Detection of NADH  Langmuir2005，21, 5596-5599.代表性专利（已授权）：刘建允，戴勇.一种多孔氧化锆/碳纳米复合纤维修饰电极及其制备和应用，授权公告号：CN106596667B刘建允,蔡文姝,程健;王珏，张赫轩，戴勇，朱天泽.一种电容吸附脱盐用Nafion/多孔碳复合电极材料的制备方法.专利号 ZL 2016 0107667.0刘建允，卢圆圆，陈梦妮，高屹立，马小玉.一种氧化锌纳米管/石墨烯复合膜修饰电极的制备方法.专利号 ZL 2015 1 0173224.5刘建允，蔡文姝，程健，熊祝标，安乐，王世平，潘浩杰，陈梦妮.一种电容去离子用聚多巴胺改性多孔碳电极的制备方法,专利号 ZL 2015 1 0173985.2刘建允，吴中玮，肖健林，杨健茂，张鑫，周鑫.一种有机硅纳米粒子修饰电极和传感器件及其制备方法，专利号：ZL 201310140942.5刘建允，卢淼，王世平，廖金金，安乐，潘浩杰，张伟.一种含有带电荷导电纳米颗粒的多孔碳复合电极及其制备和应用，专利号：ZL 2013 1 0572931.4刘建允，潘浩杰，蔡文姝，熊祝标，王世平，张伟，一种多孔碳纳米纤维毡及多孔碳纳米纤维电极的制备方法，专利号：ZL 2014 1 0581855.8刘建允，王世平，熊祝标，程健，安乐，杨健茂.一种电容去离子用多孔碳纳米纤维的制备方法，专利号：ZL 2015 1 0063832.2刘建允，蔡文姝，程健，鄢俊彬，朱国栋.一种电容吸附脱盐用分子筛/多孔碳复合电极材料及其制备方法.专利号：ZL 2016 1 0073872.xJ. Liu, Z. Zheng, Y. Liang, W. Cai, L. Li. ANIONICALLY-CHARGED POLYMER DETECTION METHOD, US patent 8025789.  L. Zheng, H. Yang, W. Cai, J. Liu, Z. Deng, H. Liu, L. Chen, X. Yu, Bipolar electrode and supercapacitor desalination device, and methods of manufacture, US Patent 9469554.刘建允,蔡巍，杨海,郑立平,熊日华.制备组合物、包含组合物的薄片及包含薄片的电极的方法， 授权公告号：CN 101685710.B 刘建允，吕苏，杨海，蔡巍.超级电容装置及其制造方法，授权公告号：CN 101615512.B国际交流与合作： 1、2002.2 – 2005.4 德国马普高分子研究所做博士后研究 2、2016.9 -2017.9   英国牛津大学访问学者学生寄语：科研之路—你我永相伴！所指导的研究生多人获得研究生国家奖学金、研究生优秀学位论文、国家大学生节能减排、挑战杯竞赛大奖等荣誉。欢迎优秀研究生加入我们的团队！主讲课程：高等分析化学（硕士研究生），现代环境工程化学（博士生），环境仪器分析（本科），创新思维与方法（本科生）联系方式：电话：67792381，E-MAIL：jianyun.liu@dhu.edu.cn"
刘亚男,教授,021-67792522,http://env.dhu.edu.cn/_upload/article/08/93/2847f29f4d19be350575ea3bd7d6/7f128748-8688-4401-aa14-1b7640b3c21b.png,liuyannan@dhu.edu.cn,http://env.dhu.edu.cn/f9/4c/c8125a129356/page.htm,"                                                                             刘亚男女，1978年生工学博士、教授、博士生导师东华大学环境学院副院长法国国家科学院博士后，上海市环境科学学会会员，国际水协会（IWA）会员, 中国印染行业协会环境保护技术专业委员会委员简介：刘亚男2005年7月毕业于哈尔滨工业大学市政环境工程学院，获工学博士学位，之后任职于东华大学（原中国纺织大学）环境科学与工程学院工作至今，职称教授，副院长。2009年至2011年期间获中法FFCSA项目资助在法国巴黎第六大学（皮埃尔·玛丽居里大学）LGPPTS实验室做博士后研究员，并获法国国家科学院颁发的博士后证书。研究方向：水污染控制、土壤修复（1）低温等离子体、微气泡和生物法去除污染物研究（2）水体及土壤中新兴污染物质的归趋、去除及其机理研究荣誉：教育部新世纪优秀人才浦江人才（特需人才）近几年主持的科研项目：上海市科委国际学术合作交流项目（中国-加拿大）（2019.1-2021.12）国家自然科学基金面上项目（2016.1-2019.12）教育部新世纪优秀人才支持计划（2013.1-2015.12）国家自然科学基金青年基金项目（2012.1-2014.12）上海市浦江人才计划（2012.10-2014.9）国家自然科学基金外国青年学者基金延续资助项目（中方责任人）（2012.1-2012.6）上海市科委基础研究重点项目（2012.1-2014.9）教育部博士点新教师基金项目（2009.1-2011.12）上海市自然科学基金（2010.4-2012.3）长江水环境教育部重点实验室开放基金项目（2009.1-2010.1）上海市重点学科“环境工程”开放基金项目东华大学科学技术发展基金项目等学生寄语：欢迎对科研有浓厚兴趣的优秀学生报考研究生。课题组简介课题组针对水体及土壤中难降解有机污染物的高效绿色降解开展研究。课题组与巴黎第六大学、加拿大麦吉尔大学、美国卡拉克森大学、同济大学等高校保持密切科研合作和人员交流。课题组秉持以人为本的理念，对学生进行充分的人文关怀，一切以学生的成长和成才为出发点，课题组气氛融洽，科研氛围浓厚。已有6名研究生获国家奖学金及上海市优秀毕业生等荣誉称号。毕业生工作去向有高校、设计院、公务员、环保企业等。研究成果:在国内外学术刊物上发表论文80余篇，授权专利16项，出版专著1部(合著)。电话：021-67792538传真：021-67792522邮箱：liuyanan@dhu.edu.cn地址：上海市松江区人民北路2999号环境科学与工程学院4155室邮编：  201620"
